{
  "caseId": "DFI-DEMO-001",
  "title": "Unexpected header information source",
  "date": "2026-09-27",
  "investigator": "Example",
  "environment": "staging",
  "stack": [
    "WordPress",
    "Browser DevTools"
  ],
  "mode": "exploratory",
  "status": "resolved",
  "problem": {
    "expected": "The obsolete header information is absent.",
    "actual": "The information remains visible although the initially suspected header setting is disabled.",
    "reproduction": [
      "Open the affected page.",
      "Observe the header information.",
      "Confirm the documented header setting is disabled."
    ]
  },
  "hypotheses": [
    {
      "id": "H1",
      "statement": "The visible content is generated by the initially suspected theme header setting.",
      "state": "rejected"
    },
    {
      "id": "H2",
      "statement": "The visible content originates from another configuration or rendering path.",
      "state": "supported"
    }
  ],
  "tests": [
    {
      "id": "P1",
      "question": "Does the rendered element carry evidence linking it to the suspected header setting?",
      "procedure": "Inspect the rendered element and relevant attributes/classes using browser developer tools without modifying production state.",
      "evidence": "Observed element origin was inconsistent with the initial setting path.",
      "interpretation": "H1 weakened/rejected; investigation moved to the alternative rendering path.",
      "risk": "Read-only inspection."
    }
  ],
  "cause": "A different configuration/rendering path supplied the visible content.",
  "correction": "Update the responsible configuration rather than the initially assumed header setting.",
  "verification": "Reload the page, confirm the obsolete content is absent, and verify neighboring header elements remain correct.",
  "limitations": [
    "Demonstration record; implementation-specific identifiers are intentionally omitted."
  ]
}